{
  "$schema": "./manifest.schema.json",
  "schemaVersion": 1,
  "target": {
    "package": "react-chessboard",
    "version": "5.10.0",
    "tag": "v5.10.0",
    "repository": "https://github.com/Clariity/react-chessboard",
    "commit": "b74704af988396d3da32a8c1627d95341e1e0061",
    "commitTree": "ce320e6926f680c9880a7a4f5af7e92f7b7e972a",
    "sourceTree": "1a18be85a7cc4af14e21fb575fc594f9a349eb19",
    "fixture": "fixtures/parity/upstream-b74704a",
    "licenseSha256": "3081fe03f1fc49022e944ab7854004c8027e92b06f8cdaf177cb0781dcf06ba0",
    "ccBySaLicenseSha256": "3f941b3b89cf7b8370ceb83cc76d2120d471b58735d8ca60238a751a48d7f72f",
    "provenanceSha256": "813bc7cca1557bb3a8a73b188c85da1416d18ae131c129dc41c47c2d1c615a17",
    "sourceFiles": [
      {
        "path": "src/Arrows.tsx",
        "lines": 188,
        "sha256": "8bbee9bbe458b341d015f069032653806334b9819c8865d9d92eb77acd221355"
      },
      {
        "path": "src/Board.tsx",
        "lines": 76,
        "sha256": "dd005f8d43a1374ed391eb7e3d0fd7204a6a728b4765b467118b5d535ab32fdc"
      },
      {
        "path": "src/Chessboard.tsx",
        "lines": 24,
        "sha256": "b9b3067cf6df4213db4b92e04aaaef23ee2dbe98135346bc7eea0eb87d9a38dd"
      },
      {
        "path": "src/ChessboardProvider.tsx",
        "lines": 730,
        "sha256": "d91f0b6e16c3cb68762162b0f9ecc7e49a93c25b778344cc19cfecfaedaf9416"
      },
      {
        "path": "src/Draggable.tsx",
        "lines": 42,
        "sha256": "40d1f91b3b2086a1f036358a8f23fd1f61a994b2fcd55c4a771480a10e527e82"
      },
      {
        "path": "src/Droppable.tsx",
        "lines": 14,
        "sha256": "e5cbac86f54277dea3bb1344d1ff727b95a147e49a44fef3ae82871ff0fae14a"
      },
      {
        "path": "src/Piece.tsx",
        "lines": 107,
        "sha256": "0b232f462975db869501fd1015a92a8071da60b7edd89314800ec52f53e11d8a"
      },
      {
        "path": "src/RightClickCancelSensor.tsx",
        "lines": 32,
        "sha256": "bb4c4a6094a2a1cff23ee27bf894479eb354fa78e5064f79fa791b2a0ee59a65"
      },
      {
        "path": "src/SparePiece.tsx",
        "lines": 14,
        "sha256": "bf7d4d58b8386486de1d0dfac018d6263dbfbd88fef0e797cb7039913720005f"
      },
      {
        "path": "src/Square.tsx",
        "lines": 285,
        "sha256": "bbc6e990208df475eb59da3ba152b2566d2c4ef996583e7bab0d04e2b9438882"
      },
      {
        "path": "src/defaults.ts",
        "lines": 77,
        "sha256": "0cb3635711a2aa545c6a4eaa8911dc3464d0673133255e352a2e9f51ae44554c"
      },
      {
        "path": "src/index.ts",
        "lines": 7,
        "sha256": "924f092d74eb0cfb35ec9da4c02165441e28c5e89619b0060d39c376ac9ad3ea"
      },
      {
        "path": "src/modifiers.ts",
        "lines": 65,
        "sha256": "0d4b470f27bffc5ea5693c0446ec9fc3e641becdd78dc478174fd34ed3618a6f"
      },
      {
        "path": "src/pieces.tsx",
        "lines": 573,
        "sha256": "6e72bf71cfcc472a0c3684410645bd564b8b8fcc2ce6e4fb51c2372d349a8668"
      },
      {
        "path": "src/types.ts",
        "lines": 70,
        "sha256": "4d932d07d7dd2a6ff0a80e9f2f0dae556dc67c9490da335d98ba3ac672e76458"
      },
      {
        "path": "src/utils.ts",
        "lines": 449,
        "sha256": "3a36ea713fce8e1d92add51796009226867ec3cad5c73302232c60196fe35ee2"
      }
    ],
    "arrowOptionDefaults": [
      {
        "name": "color",
        "expression": "'#ffaa00'"
      },
      {
        "name": "secondaryColor",
        "expression": "'#4caf50'"
      },
      {
        "name": "tertiaryColor",
        "expression": "'#f44336'"
      },
      {
        "name": "arrowLengthReducerDenominator",
        "expression": "8"
      },
      {
        "name": "sameTargetArrowLengthReducerDenominator",
        "expression": "4"
      },
      {
        "name": "arrowWidthDenominator",
        "expression": "5"
      },
      {
        "name": "activeArrowWidthMultiplier",
        "expression": "0.9"
      },
      {
        "name": "opacity",
        "expression": "0.65"
      },
      {
        "name": "activeOpacity",
        "expression": "0.5"
      },
      {
        "name": "arrowStartOffset",
        "expression": "0"
      }
    ],
    "defaultPieceRenderers": [
      "wP",
      "wR",
      "wN",
      "wB",
      "wQ",
      "wK",
      "bP",
      "bR",
      "bN",
      "bB",
      "bQ",
      "bK"
    ]
  },
  "expectedCounts": {
    "sourceFiles": 16,
    "sourceLines": 2753,
    "exports": 39,
    "runtimeExports": 27,
    "typeExports": 12,
    "defaultExports": 13,
    "options": 42,
    "explicitOptionDefaults": 30,
    "implicitUndefinedOptionDefaults": 12,
    "callbackOptions": 11,
    "styleOptions": 12,
    "rendererOptions": 1,
    "arrowOptionFields": 10,
    "defaultPieceRenderers": 12,
    "behaviors": 50,
    "entries": 131
  },
  "documentation": "docs/parity/react-chessboard-5.10.md",
  "entries": [
    {
      "id": "export.chessboard",
      "kind": "export",
      "facets": [],
      "upstream": {
        "name": "Chessboard",
        "references": [
          {
            "path": "src/Chessboard.tsx",
            "startLine": 12,
            "endLine": 23
          }
        ],
        "exportKind": "runtime"
      },
      "disposition": "adapt",
      "native": {
        "surface": "root",
        "symbols": ["Chessboard"]
      },
      "status": "in-progress",
      "contractTestId": "PARITY-EXPORT-CHESSBOARD",
      "compatibilityNotes": "The native component keeps the standalone entry point but uses direct controlled props instead of an options object."
    },
    {
      "id": "export.chessboard-provider",
      "kind": "export",
      "facets": [],
      "upstream": {
        "name": "ChessboardProvider",
        "references": [
          {
            "path": "src/ChessboardProvider.tsx",
            "startLine": 208,
            "endLine": 730
          }
        ],
        "exportKind": "runtime"
      },
      "disposition": "adapt",
      "native": {
        "surface": "root",
        "symbols": ["ChessboardProvider"]
      },
      "status": "implemented",
      "contractTestId": "PARITY-EXPORT-CHESSBOARD-PROVIDER",
      "compatibilityNotes": "The compositional native provider owns a token-safe board registry, one shared transient overlay, and external-drop measurement coordination without owning semantic board state."
    },
    {
      "id": "export.use-chessboard-context",
      "kind": "export",
      "facets": [],
      "upstream": {
        "name": "useChessboardContext",
        "references": [
          {
            "path": "src/ChessboardProvider.tsx",
            "startLine": 134,
            "endLine": 134
          }
        ],
        "exportKind": "runtime"
      },
      "disposition": "drop",
      "native": {
        "surface": "none",
        "symbols": []
      },
      "status": "planned",
      "contractTestId": "PARITY-EXPORT-USE-CHESSBOARD-CONTEXT",
      "compatibilityNotes": "The inferred 46-property browser context is intentionally private and has no public native hook.",
      "rationale": "The upstream hook leaks internal shadow position, annotation, and browser-drag state; exporting it would make those implementation details a compatibility contract.",
      "documentation": "docs/parity/react-chessboard-5.10.md#export-use-chessboard-context"
    },
    {
      "id": "export.spare-piece",
      "kind": "export",
      "facets": [],
      "upstream": {
        "name": "SparePiece",
        "references": [
          {
            "path": "src/SparePiece.tsx",
            "startLine": 8,
            "endLine": 14
          }
        ],
        "exportKind": "runtime"
      },
      "disposition": "adapt",
      "native": {
        "surface": "root",
        "symbols": ["SparePiece"]
      },
      "status": "implemented",
      "contractTestId": "PARITY-EXPORT-SPARE-PIECE",
      "compatibilityNotes": "The public root export requires an explicit provider and identifies its spareId, targetBoardId, and detached piece."
    },
    {
      "id": "export.default-board-style",
      "kind": "export",
      "facets": ["default"],
      "upstream": {
        "name": "defaultBoardStyle",
        "references": [
          {
            "path": "src/defaults.ts",
            "startLine": 1,
            "endLine": 12
          }
        ],
        "exportKind": "runtime"
      },
      "disposition": "adapt",
      "native": {
        "surface": "root",
        "symbols": ["defaultTheme.board"]
      },
      "status": "implemented",
      "contractTestId": "PARITY-EXPORT-DEFAULT-BOARD-STYLE",
      "compatibilityNotes": "CSS grid defaults become React Native theme/style defaults."
    },
    {
      "id": "export.default-square-style",
      "kind": "export",
      "facets": ["default"],
      "upstream": {
        "name": "defaultSquareStyle",
        "references": [
          {
            "path": "src/defaults.ts",
            "startLine": 14,
            "endLine": 20
          }
        ],
        "exportKind": "runtime"
      },
      "disposition": "adapt",
      "native": {
        "surface": "root",
        "symbols": ["defaultTheme.square"]
      },
      "status": "implemented",
      "contractTestId": "PARITY-EXPORT-DEFAULT-SQUARE-STYLE",
      "compatibilityNotes": "Flexbox-compatible square defaults move into the native theme."
    },
    {
      "id": "export.default-dark-square-style",
      "kind": "export",
      "facets": ["default"],
      "upstream": {
        "name": "defaultDarkSquareStyle",
        "references": [
          {
            "path": "src/defaults.ts",
            "startLine": 22,
            "endLine": 24
          }
        ],
        "exportKind": "runtime"
      },
      "disposition": "adapt",
      "native": {
        "surface": "root",
        "symbols": ["defaultTheme.darkSquare"]
      },
      "status": "implemented",
      "contractTestId": "PARITY-EXPORT-DEFAULT-DARK-SQUARE-STYLE",